{
  "version": "TransformTable-1.0",
  "meta": {
    "name": "transformationTable shared test fixture",
    "description": "Shared TransformTable instance for invoice, order, and despatch testing examples. It is schema-conformant and retains the DE->NL AE0 reverse-charge rules.",
    "createdAt": "2026-04-15T07:59:01",
    "author": "generated-by-chatgpt"
  },
  "codeLists": {
    "TaxRegimeToPeppolTaxCategory": {
      "description": "Map target tax regime token to Peppol VAT category code",
      "entries": [
        {
          "source": "TAX.AE0",
          "target": "AE"
        }
      ]
    },
    "TaxRegimeToVatExemptionReason": {
      "description": "Map target tax regime token to Peppol VAT exemption reason code",
      "entries": [
        {
          "source": "TAX.AE0",
          "target": "VATEX-EU-AE"
        }
      ]
    },
    "TaxRegimeToPercent": {
      "description": "Map target tax regime token to VAT percent value",
      "entries": [
        {
          "source": "TAX.AE0",
          "target": 0
        }
      ]
    },
    "tempRequirementCodeByTempToken": {
      "description": "Maps synthetic TEMP.* tokens to a logistics temperature requirement code set used in examples.",
      "entries": [
        {
          "source": "TEMP.Ambient",
          "target": "AMB"
        },
        {
          "source": "TEMP.Cold",
          "target": "COLD"
        }
      ]
    }
  },
  "rules": [
    {
      "ruleId": "TAX_DE_to_NL_reverse_charge_tax_category",
      "componentId": "TaxCategory_BBIE",
      "relevantAxes": [
        "BP",
        "TAX"
      ],
      "priority": 100,
      "when": {
        "source": {
          "GE": "GE.EU.DE",
          "BP": "BP.Invoice(380)",
          "TAX": "TAX.S20"
        },
        "target": {
          "GE": "GE.EU.NL",
          "BP": "BP.Invoice(380)",
          "TAX": "TAX.AE0"
        }
      },
      "then": {
        "writes": [
          {
            "targetPath": "/Invoice/cac:TaxTotal/cac:TaxSubtotal[j+1]/cac:TaxCategory/cbc:ID",
            "value": {
              "kind": "lookup",
              "tableId": "TaxRegimeToPeppolTaxCategory",
              "input": {
                "kind": "literal",
                "value": "TAX.AE0"
              },
              "onMissing": {
                "action": "error"
              }
            }
          },
          {
            "targetPath": "/Invoice/cac:TaxTotal/cac:TaxSubtotal[j+1]/cac:TaxCategory/cbc:Percent",
            "value": {
              "kind": "lookup",
              "tableId": "TaxRegimeToPercent",
              "input": {
                "kind": "literal",
                "value": "TAX.AE0"
              },
              "onMissing": {
                "action": "error"
              }
            }
          },
          {
            "targetPath": "/Invoice/cac:TaxTotal/cac:TaxSubtotal[j+1]/cac:TaxCategory/cbc:TaxExemptionReasonCode",
            "value": {
              "kind": "lookup",
              "tableId": "TaxRegimeToVatExemptionReason",
              "input": {
                "kind": "literal",
                "value": "TAX.AE0"
              },
              "onMissing": {
                "action": "error"
              }
            }
          }
        ]
      },
      "constraints": [
        {
          "standard": "EN16931 (UBL binding)",
          "rule": "BR-AE-01"
        },
        {
          "standard": "EN16931 (UBL binding)",
          "rule": "BR-AE-10"
        },
        {
          "standard": "Peppol BIS Billing 3.0",
          "rule": "PEPPOL-EN16931-P0107"
        }
      ],
      "references": [
        {
          "standard": "Peppol BIS Billing 3.0",
          "id": "Reverse charge category/value mapping for AE"
        },
        {
          "standard": "VATEX code list",
          "id": "VATEX-EU-AE only with tax category AE"
        }
      ],
      "tests": [
        {
          "id": "TAX_DE_to_NL_reverse_charge_tax_category.test1",
          "type": "assert",
          "message": "AE0 target regime requires AE tax category and VATEX-EU-AE reason code"
        },
        {
          "id": "TAX_DE_to_NL_reverse_charge_tax_category.test2",
          "type": "assert",
          "message": "TaxCategory writes must target VAT breakdown TaxCategory fields"
        }
      ]
    },
    {
      "ruleId": "TAX_DE_to_NL_reverse_charge_taxable_amount",
      "componentId": "TaxableAmount_BBIE",
      "relevantAxes": [
        "BP",
        "TAX"
      ],
      "priority": 90,
      "when": {
        "source": {
          "GE": "GE.EU.DE",
          "BP": "BP.Invoice(380)",
          "TAX": "TAX.S20"
        },
        "target": {
          "GE": "GE.EU.NL",
          "BP": "BP.Invoice(380)",
          "TAX": "TAX.AE0"
        }
      },
      "then": {
        "writes": [
          {
            "targetPath": "/Invoice/cac:TaxTotal/cac:TaxSubtotal[j+1]/cbc:TaxableAmount",
            "value": {
              "kind": "source_value",
              "sourcePath": "$.invoice.taxTotals[j].taxSubtotals[k].taxableAmount"
            }
          }
        ]
      },
      "constraints": [
        {
          "standard": "EN16931 (UBL binding)",
          "rule": "BR-AE-08"
        },
        {
          "standard": "EN16931 (UBL binding)",
          "rule": "BR-DEC-19"
        }
      ],
      "references": [
        {
          "standard": "Peppol BIS Billing 3.0",
          "id": "Reverse-charge VAT breakdown taxable amount"
        }
      ],
      "tests": [
        {
          "id": "TAX_DE_to_NL_reverse_charge_taxable_amount.test1",
          "type": "assert",
          "message": "For reverse charge, taxable amount is preserved as the VAT base"
        },
        {
          "id": "TAX_DE_to_NL_reverse_charge_taxable_amount.test2",
          "type": "assert",
          "message": "Validate taxable amount against source breakdown or recomputation at runtime"
        }
      ]
    },
    {
      "ruleId": "TAX_DE_to_NL_reverse_charge_tax_amount_zero",
      "componentId": "TaxAmount_BBIE",
      "relevantAxes": [
        "BP",
        "TAX"
      ],
      "priority": 90,
      "when": {
        "source": {
          "GE": "GE.EU.DE",
          "BP": "BP.Invoice(380)",
          "TAX": "TAX.S20"
        },
        "target": {
          "GE": "GE.EU.NL",
          "BP": "BP.Invoice(380)",
          "TAX": "TAX.AE0"
        }
      },
      "then": {
        "writes": [
          {
            "targetPath": "/Invoice/cac:TaxTotal/cac:TaxSubtotal[j+1]/cbc:TaxAmount",
            "value": {
              "kind": "literal",
              "value": 0
            }
          }
        ]
      },
      "constraints": [
        {
          "standard": "EN16931 (UBL binding)",
          "rule": "BR-AE-09"
        },
        {
          "standard": "EN16931 (UBL binding)",
          "rule": "BR-DEC-20"
        }
      ],
      "references": [
        {
          "standard": "Peppol BIS Billing 3.0",
          "id": "Reverse-charge VAT amount zero"
        }
      ],
      "tests": [
        {
          "id": "TAX_DE_to_NL_reverse_charge_tax_amount_zero.test1",
          "type": "assert",
          "message": "Reverse-charge VAT amount must be 0"
        }
      ]
    },
    {
      "ruleId": "TAX_DE_to_NL_reverse_charge_tax_total_package",
      "componentId": "TaxTotal_ABIE",
      "relevantAxes": [
        "BP",
        "TAX"
      ],
      "priority": 80,
      "when": {
        "source": {
          "GE": "GE.EU.DE",
          "BP": "BP.Invoice(380)",
          "TAX": "TAX.S20"
        },
        "target": {
          "GE": "GE.EU.NL",
          "BP": "BP.Invoice(380)",
          "TAX": "TAX.AE0"
        }
      },
      "then": {
        "writes": [
          {
            "targetPath": "/Invoice/cac:TaxTotal/cbc:TaxAmount",
            "value": {
              "kind": "literal",
              "value": 0
            }
          },
          {
            "targetPath": "/Invoice/cac:TaxTotal/cac:TaxSubtotal[j+1]/cbc:TaxableAmount",
            "value": {
              "kind": "source_value",
              "sourcePath": "$.invoice.taxTotals[j].taxSubtotals[k].taxableAmount"
            }
          },
          {
            "targetPath": "/Invoice/cac:TaxTotal/cac:TaxSubtotal[j+1]/cbc:TaxAmount",
            "value": {
              "kind": "literal",
              "value": 0
            }
          },
          {
            "targetPath": "/Invoice/cac:TaxTotal/cac:TaxSubtotal[j+1]/cac:TaxCategory/cbc:ID",
            "value": {
              "kind": "lookup",
              "tableId": "TaxRegimeToPeppolTaxCategory",
              "input": {
                "kind": "literal",
                "value": "TAX.AE0"
              },
              "onMissing": {
                "action": "error"
              }
            }
          },
          {
            "targetPath": "/Invoice/cac:TaxTotal/cac:TaxSubtotal[j+1]/cac:TaxCategory/cbc:Percent",
            "value": {
              "kind": "lookup",
              "tableId": "TaxRegimeToPercent",
              "input": {
                "kind": "literal",
                "value": "TAX.AE0"
              },
              "onMissing": {
                "action": "error"
              }
            }
          },
          {
            "targetPath": "/Invoice/cac:TaxTotal/cac:TaxSubtotal[j+1]/cac:TaxCategory/cbc:TaxExemptionReasonCode",
            "value": {
              "kind": "lookup",
              "tableId": "TaxRegimeToVatExemptionReason",
              "input": {
                "kind": "literal",
                "value": "TAX.AE0"
              },
              "onMissing": {
                "action": "error"
              }
            }
          }
        ]
      },
      "constraints": [
        {
          "standard": "EN16931 (UBL binding)",
          "rule": "BR-AE-01"
        },
        {
          "standard": "EN16931 (UBL binding)",
          "rule": "BR-AE-08"
        },
        {